{
  "@context": [
    "https://w3id.org/kim/amb/context.jsonld",
    {
      "@language": "de"
    }
  ],
  "id": "https://example.org/course",
  "name": "Beispielkurs",
  "type": ["LearningResource", "Course"],
  "funder": [
    {
      "type": "FundingScheme",
      "id": "https://example.org/foerderprogramm",
      "name": "FÃ¶rderprogramm A"
    }
  ]
}
